{
  "GENRE": "oss-dive",
  "PROJECT_ID": "example-oss-project",
  "PROJECT_TITLE": "Deep Dive: Example OSS Project",
  "REPO_ROOT_PATH": "inputs/repos/example-oss-project",
  "DEEP_DIVE_FOCUS": "アーキテクチャと設計思想",
  "SOURCE_MARKDOWN_PATHS": "",
  "AUDIENCE_BACKGROUND": "Web開発経験のあるエンジニア",
  "AUDIENCE_LEVEL": "中級（日常的にOSSを利用しているが内部実装は未読）",
  "AUDIENCE_INTEREST": "設計思想、アーキテクチャパターン、実務での活用判断",
  "BASELINE_CONTEXT_OR_EMPTY": "",
  "EXISTING_AUDIO_SCRIPT_DIR_OR_EMPTY": "",
  "PROJECT_BLUEPRINT_JSON_PATH": "projects/example-oss-project/run-YYYYMMDD-HHMM/blueprint/project_blueprint.json",
  "EPISODE_ID": "E01",
  "OUTPUT_BLUEPRINT_JSON": "projects/example-oss-project/run-YYYYMMDD-HHMM/blueprint/project_blueprint.json",
  "OUTPUT_EPISODE_MATERIAL_JSON_PATTERN": "projects/example-oss-project/run-YYYYMMDD-HHMM/material/E##_material.json",
  "OUTPUT_EPISODE_SCRIPT_MD_PATTERN": "projects/example-oss-project/run-YYYYMMDD-HHMM/script/E##_script.md",
  "STYLE_ID": "radio-talk",
  "CAST": {
    "lead": "teacher",
    "questioner": "student"
  },
  "NOTES": "REPO_ROOT_PATHにclone先を指定。DEEP_DIVE_FOCUSで深掘りの方向性を設定。SOURCE_MARKDOWN_PATHSは空文字で運用。"
}
